{
  "schema_version": "2.0",
  "publication_key": "fixture-2022-second-fixture-journal-2-1",
  "citation": {
    "authors": ["Fixture D"],
    "title": "Second Fixture Classifier, first edition",
    "journal": "Second Fixture Journal",
    "year": 2022,
    "volume": "2",
    "issue": "1",
    "pages": "1-5",
    "display": "Fixture D. Second Fixture Classifier, first edition. Second Fixture Journal. 2022;2(1):1-5.",
    "citation_incomplete": []
  },
  "publication_type": "consensus statement",
  "extraction_date": "2026-01-01",
  "extraction_model": "fixture-carding-model",
  "audit_model": "fixture-audit-model",
  "genes_covered": ["GENEA"],
  "diseases_covered": ["AML"],
  "census_entries": 1,
  "cards": [
    {
      "card_id": "fixture-2022-second-fixture-journal-2-1-genea-dx-001",
      "locator": "Section 1 - Entity definition",
      "interpretation": "FIXTURE. Under Second Fixture Classifier first edition, GENEA mutation defines Fixture Entity One, recorded here as AML, at any blast count; no blast threshold applies. The source does not state an exclusion.",
      "genes": ["GENEA"],
      "diseases": ["AML"],
      "category": "diagnosis",
      "evidence_tier": "guideline criterion",
      "escalates_to": "AML",
      "secondary_citation": null
    },
    {
      "card_id": "fixture-2022-second-fixture-journal-2-1-genea-mrd-002",
      "locator": "Section 3 - Follow-up marker",
      "interpretation": "FIXTURE. GENEA mutation is a validated fixture follow-up marker and should be tracked with a high-sensitivity assay. The source does not state the assay threshold or the timepoints at which it applies.",
      "genes": ["GENEA"],
      "diseases": ["AML"],
      "category": "biomarker",
      "evidence_tier": "guideline criterion",
      "escalates_to": null,
      "secondary_citation": null
    }
  ]
}
